{
 "$schema": "urn:comfyui-diffusiongemma:dg-engine:i0:node-modes:v1",
 "schema": 1,
 "kind": "dg-engine-i0-node-modes",
 "draft": false,
 "gate_eligible": false,
 "baseline": "fed377afc7b54f03cb7faa4dd798c80c15279d8a",
 "observed_worktree": "7febb631a4e24173c8bd643e3ddbfa61dda078ef",
 "baseline_delta": {
  "status": "NO_PRODUCT_SOURCE_DELTA",
  "changed_preexisting_paths": [],
  "note": "All node/core paths are byte-identical to the pinned product baseline; engine-design is additive."
 },
 "registered_node_count": 8,
 "registered_mapping_evidence": "__init__.py:72-90",
 "object_info_contract": {
  "comfyui_repository": "https://github.com/comfyanonymous/ComfyUI",
  "comfyui_revision": "7cf4e7833519cbe9eff0e45767d01fd365d12a86",
  "source": {
   "server.py": {
    "lines": "733-801",
    "sha256": "0831037168cef27fd0b8e495acc7e82a875f145e0410cf3df6b659d0f222687f",
    "artifact_id": "comfy.server",
    "url": "https://github.com/comfyanonymous/ComfyUI/blob/7cf4e7833519cbe9eff0e45767d01fd365d12a86/server.py"
   },
   "nodes.py": {
    "lines": "2276-2279",
    "sha256": "b8dfdde1de8975be762b085048143cc2dda8fc9202695e460ecc2c8dfe44bc4b",
    "artifact_id": "comfy.nodes",
    "url": "https://github.com/comfyanonymous/ComfyUI/blob/7cf4e7833519cbe9eff0e45767d01fd365d12a86/nodes.py"
   }
  },
  "endpoints": [
   "/object_info",
   "/object_info/{node_class}"
  ],
  "outer_shape": "{<node mapping key>: <node info object>}",
  "input_encoding": "INPUT_TYPES values; COMBO choices remain arrays and socket types remain strings",
  "always_present": [
   "input",
   "input_order",
   "is_input_list",
   "output",
   "output_is_list",
   "output_name",
   "name",
   "display_name",
   "description",
   "python_module",
   "category",
   "output_node",
   "has_intermediate_output",
   "search_aliases"
  ],
  "conditional": [
   "output_tooltips",
   "deprecated",
   "experimental",
   "dev_only",
   "api_node",
   "essentials_category"
  ],
  "runtime_variability": {
   "DGemmaLoader.local_model_dir": "choices are supplied by list_local_model_dirs(); inventory uses <runtime-local-model-directory> sentinel and tests patch only that provider"
  },
  "double_evaluation": "ComfyUI calls INPUT_TYPES twice while constructing object_info; implementations must be side-effect free.",
  "python_module": "custom_nodes.ComfyUI-DiffusionGemma"
 },
 "nodes": [
  {
   "mapping_key": "DGemmaLoader",
   "registered_class": "DGemmaLoader",
   "display_name": "DiffusionGemma Loader",
   "source": "surfaces/comfyui/loader.py",
   "source_range": "surfaces/comfyui/loader.py:258-356",
   "function": "load",
   "category": "DiffusionGemma",
   "description": "",
   "input_is_list": false,
   "output_node": false,
   "call_topology": [
    "INPUT_TYPES quant/local directory",
    "resolve_local_model_dir for optional path",
    "dgemma.model.load_model(repo_id=<resolved path or None>, quant, local_files_only)",
    "transformers DiffusionGemmaForBlockDiffusion.from_pretrained + AutoProcessor.from_pretrained",
    "DGemmaModel"
   ],
   "modes": [
    {
     "name": "transformers-bf16",
     "selector": "quant=none",
     "implemented": true,
     "checkpoint_default": "google/diffusiongemma-26B-A4B-it",
     "status": "working path per AGENTS.md:164-165"
    },
    {
     "name": "transformers-autoround-int4",
     "selector": "quant=autoround",
     "implemented": "load code exists",
     "checkpoint_default": "Intel/diffusiongemma-26B-A4B-it-int4-AutoRound",
     "status": "declared but known non-functional end-to-end: _assert_tie_integrity reaches QuantLinear without .weight; AGENTS.md:166-169",
     "native_engine_distribution": "excluded",
     "release_qualification": "excluded; inventory and defect evidence only"
    },
    {
     "name": "local-folder",
     "selector": "local_model_dir wired",
     "implemented": true,
     "notes": "forces local_files_only and path guard"
    },
    {
     "name": "native-gguf",
     "implemented": false,
     "notes": "not in current node contract"
    }
   ],
   "backend_modes": [
    "transformers:none",
    "transformers:autoround"
   ],
   "cancellation": {
    "implemented": true,
    "granularity": "four phase boundaries only; cannot interrupt inside blocking from_pretrained",
    "surface_behavior": "LoadInterrupted translated to comfy.model_management.InterruptProcessingException",
    "evidence": "dgemma/model.py:924-972,1089-1110; surfaces/comfyui/loader.py:293-356"
   },
   "capabilities": {
    "implemented": [
     "HF/local checkpoint resolution",
     "bf16 device_map=auto load",
     "AutoRound patch path and preflight guards",
     "model+processor socket"
    ],
    "declared_but_broken": [
     "autoround end-to-end"
    ],
    "not_exposed": [
     "native GGUF/backend selection",
     "explicit repo_id",
     "local_files_only widget",
     "unload"
    ],
    "excluded_from_native_engine_distribution": [
     "AutoRound model/assets",
     "AutoRound backend release qualification"
    ]
   },
   "fail_loud": [
    "unknown quant",
    "unresolved/traversal local_model_dir",
    "quant/checkpoint mismatch",
    "AutoRound free-VRAM floor",
    "missing auto-round",
    "unresolvable repo/cache",
    "stranded meta tensors",
    "tie-integrity corruption",
    "no CUDA"
   ],
   "object_info_projection": {
    "input": {
     "required": {
      "quant": [
       [
        "none",
        "autoround"
       ],
       {
        "default": "none",
        "tooltip": "none = full bf16 (~53GB VRAM) \u00b7 autoround = pre-quantized INT4 (~30GB VRAM, requires auto-round extra)"
       }
      ]
     },
     "optional": {
      "local_model_dir": [
       [
        "<runtime-local-model-directory>"
       ]
      ]
     }
    },
    "input_order": {
     "required": [
      "quant"
     ],
     "optional": [
      "local_model_dir"
     ]
    },
    "is_input_list": false,
    "output": [
     "DGEMMA_MODEL"
    ],
    "output_is_list": [
     false
    ],
    "output_name": [
     "model"
    ],
    "name": "DGemmaLoader",
    "display_name": "DiffusionGemma Loader",
    "description": "",
    "python_module": "custom_nodes.ComfyUI-DiffusionGemma",
    "category": "DiffusionGemma",
    "output_node": false,
    "has_intermediate_output": false,
    "search_aliases": []
   },
   "source_sha256": "666e68391ca1347087b67cd1f37364c70191d1dd58a172b7ec24c3c02f2ae5ca",
   "baseline_git_blob_sha1": "fb58a14a16111aeeb5cf3b533ba49ef6e8c6ef2f"
  },
  {
   "mapping_key": "DGemmaSampler",
   "registered_class": "DGemmaSampler",
   "display_name": "DiffusionGemma Sampler",
   "source": "surfaces/comfyui/sampler.py",
   "source_range": "surfaces/comfyui/sampler.py:216-419",
   "function": "sample",
   "category": "DiffusionGemma",
   "description": "Drives the denoising loop for one prompt. Six outputs: text, canvas_state, canvas_trace, frames, images, run_config (wire the last four into DGemmaRunLogWriter for a run log, or canvas_trace into DGemmaTrace/DGemmaTokenTrace for analysis). Use DGemmaDenoise instead if you need to condition on a KV-cache.",
   "input_is_list": false,
   "output_node": false,
   "call_topology": [
    "build_on_frame(unique_id) and _build_should_cancel()",
    "dgemma.loop.run_diffusion with scalar widgets and thinking",
    "EntropyBoundScheduler + DGemmaPipeline + StepEndComposite",
    "build_sampler_shaped_outputs",
    "decode_frames + render_frames_to_image_batch + RunConfig"
   ],
   "modes": [
    {
     "name": "text-default",
     "selector": "thinking=false",
     "implemented": true
    },
    {
     "name": "thinking-experimental",
     "selector": "thinking=true",
     "implemented": true,
     "status": "one newline token short of native enable_thinking render; behavioral parity unverified"
    },
    {
     "name": "tier0-trace",
     "selector": "always when callback logits reachable",
     "implemented": true
    },
    {
     "name": "constraints/control/topk/full-distribution",
     "implemented_in_core": true,
     "exposed_by_node": false
    }
   ],
   "backend_modes": [
    "loaded DGemmaModel only; current loader yields transformers:none or transformers:autoround"
   ],
   "cancellation": {
    "implemented": true,
    "poll": "once per callback step",
    "ordering": "capture then cancellation before writers",
    "result": "partial standard six-output shape; includes cancelled step frame",
    "display_callback_failures": "swallowed at display closure; engine analysis callback failures otherwise propagate",
    "evidence": "surfaces/comfyui/sampler.py:361-399; dgemma/composite.py:214-248; dgemma/loop.py:898-940"
   },
   "capabilities": {
    "implemented": [
     "single prompt text generation",
     "seeded generation",
     "multi-canvas by gen_length ceiling",
     "Tier-0 entropy",
     "raw trace",
     "thinking path",
     "frame strings",
     "IMAGE batch",
     "run config",
     "live view",
     "partial cancellation"
    ],
    "core_only_not_exposed": [
     "constraints",
     "control_signals",
     "capture top_k",
     "capture full distribution",
     "KV injection"
    ],
    "not_implemented": [
     "native backend selector"
    ]
   },
   "fail_loud": [
    "t_min>=t_max",
    "invalid core ingress if called programmatically",
    "pipeline gen_length/step count <=0",
    "callback errors except guarded display",
    "model/runtime failures"
   ],
   "object_info_projection": {
    "input": {
     "required": {
      "model": [
       "DGEMMA_MODEL",
       {
        "tooltip": "Loaded DiffusionGemma model (from DGemmaLoader)."
       }
      ],
      "prompt": [
       "STRING",
       {
        "multiline": true,
        "default": "",
        "tooltip": "The user turn to generate a response to."
       }
      ],
      "seed": [
       "INT",
       {
        "default": 0,
        "min": 0,
        "max": 18446744073709551615,